Timestamp,What is your participant number?,What is your major?,What is your current year?,What was your iPad number?,The number of items on the screen impacted my ability to communicate,How did the number of items on the screen affect your ability to communicate?,What do you think about the number of items on the screen?,"Overall, how much were you able to express what you wanted to communicate?",What enhanced and/or limited your ability to express your thoughts?,"I would be able to use this tool to make requests (i.e., asking for help).",Why or why not?,I would be able to use this tool to have a conversation,Why or why not?,What is the best thing about using the app to communicate?,What is the worst thing about using the app to communicate?
4-2-2020 14:51:32,1,Education,Third,1,4,"Some things needed to be typed, but there were a lot of choices making it easy to communicate",There were too few items on the screen,I could communicate fully,The ease of usage enhanced my ability,5,"Anything that wasn't listed, could be typed so I could ask for anything I want",5,Easily used to express myself ,How easy it is to use,"The automated voice, could be humanized a little bit"
4-2-2020 18:20:37,2,Computer Science,Fifth or more,2,5,I had trouble finding the basic structural words of a sentence.,There were too many items on the screen,I could communicate most of my thoughts,"A lot of regularly used words were on the main page, however I feel that some words that weren't on the main screen were too difficult to find. The other things that limited my ability was that some categories for words didn't make any sense. ",3,When asking for help I would only respond vaguely because I  couldn't find the words that I needed.,3,I could use the tool but it would take way too long for me to type a sentence.,When the category tabs had words inside of them that made sense. ,There are too many images on the screen at one time. 
4-3-2020 12:53:18,3,Education,Fourth,3,5,There were too many options. I would give up and just type answer,There were too many items on the screen,I could communicate some of my thoughts,Not being able to find what I wanted fast enough. I just made everything short and sweet.,4,Help was easy to find,2,It takes a long time and people feel impatient,not have to use voice to communicate,hard to find options
4-3-2020 13:39:06,4,Education,Third,1,1,"The number of items on the screen only affected my ability to communicate because I thought the questions that were asked were going to pertain to items on the screen. However, I actually had to type most of my words out. ",There were too few items on the screen,I could communicate fully,"My preconceptions of the app. I thought I was going to be able to use the apps items on the screen fully to answer my questions, but had to use the key board. ",5,"I would be able to use this tool to make a request because of the key board, and other items on the app. ",5,I would be able to use this tool to have a conversation because there are icons I can use for specific conversations and there is a key board for things I want to say that are not items on the app.,"The best thing about using the app to communicate is that the app has a key board for words that are not on the screen. Furthermore, I enjoyed just being able to click anywhere in the white space for the text box to reply fully. ",The worst thing about using the app is that I had to type out most of what I wanted to respond when asked questions.
4-4-2020 12:31:30,5,Education,Fourth,2,5,The number of items affected my ability because some were folders for other items that to me didn't make sense all time. So I had to dig a lot and click may different buttons to try and find what I wanted to say. ,There were too few items on the screen,I could communicate most of my thoughts,To me I wanted to make a full sentence so that they could understand me clearly and not have to form a sentence together in their head. But I struggled finding all the small words and not common terms in the items to use.,5,"I feel that asking help in general is a common question amongst students, but asking help with multiplying 2 numbers is not which is where I struggled with being specific. ",4,"If you knew in an advance what your conversation was about, yes I would use this. But I took me so long to form a simple question at times that the conversation wouldn't be as engaging.","The pictures help give you an idea what it is saying without reading the word, so if you struggle figuring out the word the picture goes along with it giving you a visual.",It takes an extremely long time trying to get what you want said by clicking a number of buttons. The conversation wouldn't be too engaging. 
